[
  {
    "reactionId": "r1",
    "temperature": 20,
    "concentration": 0.1,
    "catalyst": "None",
    "time": 5,
    "yield": 47.6
  },
  {
    "reactionId": "r1",
    "temperature": 20,
    "concentration": 0.1,
    "catalyst": "None",
    "time": 10,
    "yield": 49.6
  },
  {
    "reactionId": "r1",
    "temperature": 20,
    "concentration": 0.1,
    "catalyst": "None",
    "time": 20,
    "yield": 51.3
  },
  {
    "reactionId": "r1",
    "temperature": 20,
    "concentration": 0.1,
    "catalyst": "None",
    "time": 30,
    "yield": 50
  },
  {
    "reactionId": "r1",
    "temperature": 20,
    "concentration": 0.3,
    "catalyst": "None",
    "time": 5,
    "yield": 51.2
  },
  {
    "reactionId": "r1",
    "temperature": 20,
    "concentration": 0.3,
    "catalyst": "None",
    "time": 10,
    "yield": 53.2
  },
  {
    "reactionId": "r1",
    "temperature": 20,
    "concentration": 0.3,
    "catalyst": "None",
    "time": 20,
    "yield": 55
  },
  {
    "reactionId": "r1",
    "temperature": 20,
    "concentration": 0.3,
    "catalyst": "None",
    "time": 30,
    "yield": 52.9
  },
  {
    "reactionId": "r1",
    "temperature": 20,
    "concentration": 0.5,
    "catalyst": "None",
    "time": 5,
    "yield": 53.3
  },
  {
    "reactionId": "r1",
    "temperature": 20,
    "concentration": 0.5,
    "catalyst": "None",
    "time": 10,
    "yield": 55.7
  },
  {
    "reactionId": "r1",
    "temperature": 20,
    "concentration": 0.5,
    "catalyst": "None",
    "time": 20,
    "yield": 58.3
  },
  {
    "reactionId": "r1",
    "temperature": 20,
    "concentration": 0.5,
    "catalyst": "None",
    "time": 30,
    "yield": 56.4
  },
  {
    "reactionId": "r1",
    "temperature": 20,
    "concentration": 0.6,
    "catalyst": "None",
    "time": 5,
    "yield": 52.7
  },
  {
    "reactionId": "r1",
    "temperature": 20,
    "concentration": 0.6,
    "catalyst": "None",
    "time": 10,
    "yield": 56.7
  },
  {
    "reactionId": "r1",
    "temperature": 20,
    "concentration": 0.6,
    "catalyst": "None",
    "time": 20,
    "yield": 59.5
  },
  {
    "reactionId": "r1",
    "temperature": 20,
    "concentration": 0.6,
    "catalyst": "None",
    "time": 30,
    "yield": 56.7
  },
  {
    "reactionId": "r1",
    "temperature": 20,
    "concentration": 0.8,
    "catalyst": "None",
    "time": 5,
    "yield": 51.7
  },
  {
    "reactionId": "r1",
    "temperature": 20,
    "concentration": 0.8,
    "catalyst": "None",
    "time": 10,
    "yield": 55.5
  },
  {
    "reactionId": "r1",
    "temperature": 20,
    "concentration": 0.8,
    "catalyst": "None",
    "time": 20,
    "yield": 57.7
  },
  {
    "reactionId": "r1",
    "temperature": 20,
    "concentration": 0.8,
    "catalyst": "None",
    "time": 30,
    "yield": 54.3
  },
  {
    "reactionId": "r1",
    "temperature": 20,
    "concentration": 1,
    "catalyst": "None",
    "time": 5,
    "yield": 50
  },
  {
    "reactionId": "r1",
    "temperature": 20,
    "concentration": 1,
    "catalyst": "None",
    "time": 10,
    "yield": 50.8
  },
  {
    "reactionId": "r1",
    "temperature": 20,
    "concentration": 1,
    "catalyst": "None",
    "time": 20,
    "yield": 53.2
  },
  {
    "reactionId": "r1",
    "temperature": 20,
    "concentration": 1,
    "catalyst": "None",
    "time": 30,
    "yield": 50.9
  },
  {
    "reactionId": "r1",
    "temperature": 30,
    "concentration": 0.1,
    "catalyst": "None",
    "time": 5,
    "yield": 52.4
  },
  {
    "reactionId": "r1",
    "temperature": 30,
    "concentration": 0.1,
    "catalyst": "None",
    "time": 10,
    "yield": 55.2
  },
  {
    "reactionId": "r1",
    "temperature": 30,
    "concentration": 0.1,
    "catalyst": "None",
    "time": 20,
    "yield": 57.7
  },
  {
    "reactionId": "r1",
    "temperature": 30,
    "concentration": 0.1,
    "catalyst": "None",
    "time": 30,
    "yield": 55.8
  },
  {
    "reactionId": "r1",
    "temperature": 30,
    "concentration": 0.3,
    "catalyst": "None",
    "time": 5,
    "yield": 59.1
  },
  {
    "reactionId": "r1",
    "temperature": 30,
    "concentration": 0.3,
    "catalyst": "None",
    "time": 10,
    "yield": 61.9
  },
  {
    "reactionId": "r1",
    "temperature": 30,
    "concentration": 0.3,
    "catalyst": "None",
    "time": 20,
    "yield": 66.1
  },
  {
    "reactionId": "r1",
    "temperature": 30,
    "concentration": 0.3,
    "catalyst": "None",
    "time": 30,
    "yield": 61.8
  },
  {
    "reactionId": "r1",
    "temperature": 30,
    "concentration": 0.5,
    "catalyst": "None",
    "time": 5,
    "yield": 61.2
  },
  {
    "reactionId": "r1",
    "temperature": 30,
    "concentration": 0.5,
    "catalyst": "None",
    "time": 10,
    "yield": 66.9
  },
  {
    "reactionId": "r1",
    "temperature": 30,
    "concentration": 0.5,
    "catalyst": "None",
    "time": 20,
    "yield": 71.2
  },
  {
    "reactionId": "r1",
    "temperature": 30,
    "concentration": 0.5,
    "catalyst": "None",
    "time": 30,
    "yield": 67.1
  },
  {
    "reactionId": "r1",
    "temperature": 30,
    "concentration": 0.6,
    "catalyst": "None",
    "time": 5,
    "yield": 62.4
  },
  {
    "reactionId": "r1",
    "temperature": 30,
    "concentration": 0.6,
    "catalyst": "None",
    "time": 10,
    "yield": 67.6
  },
  {
    "reactionId": "r1",
    "temperature": 30,
    "concentration": 0.6,
    "catalyst": "None",
    "time": 20,
    "yield": 71.9
  },
  {
    "reactionId": "r1",
    "temperature": 30,
    "concentration": 0.6,
    "catalyst": "None",
    "time": 30,
    "yield": 66.5
  },
  {
    "reactionId": "r1",
    "temperature": 30,
    "concentration": 0.8,
    "catalyst": "None",
    "time": 5,
    "yield": 61.3
  },
  {
    "reactionId": "r1",
    "temperature": 30,
    "concentration": 0.8,
    "catalyst": "None",
    "time": 10,
    "yield": 64.8
  },
  {
    "reactionId": "r1",
    "temperature": 30,
    "concentration": 0.8,
    "catalyst": "None",
    "time": 20,
    "yield": 68.4
  },
  {
    "reactionId": "r1",
    "temperature": 30,
    "concentration": 0.8,
    "catalyst": "None",
    "time": 30,
    "yield": 64.2
  },
  {
    "reactionId": "r1",
    "temperature": 30,
    "concentration": 1,
    "catalyst": "None",
    "time": 5,
    "yield": 55.4
  },
  {
    "reactionId": "r1",
    "temperature": 30,
    "concentration": 1,
    "catalyst": "None",
    "time": 10,
    "yield": 59.5
  },
  {
    "reactionId": "r1",
    "temperature": 30,
    "concentration": 1,
    "catalyst": "None",
    "time": 20,
    "yield": 62.5
  },
  {
    "reactionId": "r1",
    "temperature": 30,
    "concentration": 1,
    "catalyst": "None",
    "time": 30,
    "yield": 59.2
  },
  {
    "reactionId": "r1",
    "temperature": 40,
    "concentration": 0.1,
    "catalyst": "None",
    "time": 5,
    "yield": 58.6
  },
  {
    "reactionId": "r1",
    "temperature": 40,
    "concentration": 0.1,
    "catalyst": "None",
    "time": 10,
    "yield": 61
  },
  {
    "reactionId": "r1",
    "temperature": 40,
    "concentration": 0.1,
    "catalyst": "None",
    "time": 20,
    "yield": 65
  },
  {
    "reactionId": "r1",
    "temperature": 40,
    "concentration": 0.1,
    "catalyst": "None",
    "time": 30,
    "yield": 61
  },
  {
    "reactionId": "r1",
    "temperature": 40,
    "concentration": 0.3,
    "catalyst": "None",
    "time": 5,
    "yield": 64.8
  },
  {
    "reactionId": "r1",
    "temperature": 40,
    "concentration": 0.3,
    "catalyst": "None",
    "time": 10,
    "yield": 70.9
  },
  {
    "reactionId": "r1",
    "temperature": 40,
    "concentration": 0.3,
    "catalyst": "None",
    "time": 20,
    "yield": 76.3
  },
  {
    "reactionId": "r1",
    "temperature": 40,
    "concentration": 0.3,
    "catalyst": "None",
    "time": 30,
    "yield": 71.1
  },
  {
    "reactionId": "r1",
    "temperature": 40,
    "concentration": 0.5,
    "catalyst": "None",
    "time": 5,
    "yield": 70.3
  },
  {
    "reactionId": "r1",
    "temperature": 40,
    "concentration": 0.5,
    "catalyst": "None",
    "time": 10,
    "yield": 76.1
  },
  {
    "reactionId": "r1",
    "temperature": 40,
    "concentration": 0.5,
    "catalyst": "None",
    "time": 20,
    "yield": 82
  },
  {
    "reactionId": "r1",
    "temperature": 40,
    "concentration": 0.5,
    "catalyst": "None",
    "time": 30,
    "yield": 76.3
  },
  {
    "reactionId": "r1",
    "temperature": 40,
    "concentration": 0.6,
    "catalyst": "None",
    "time": 5,
    "yield": 70.7
  },
  {
    "reactionId": "r1",
    "temperature": 40,
    "concentration": 0.6,
    "catalyst": "None",
    "time": 10,
    "yield": 76.9
  },
  {
    "reactionId": "r1",
    "temperature": 40,
    "concentration": 0.6,
    "catalyst": "None",
    "time": 20,
    "yield": 83.2
  },
  {
    "reactionId": "r1",
    "temperature": 40,
    "concentration": 0.6,
    "catalyst": "None",
    "time": 30,
    "yield": 76.6
  },
  {
    "reactionId": "r1",
    "temperature": 40,
    "concentration": 0.8,
    "catalyst": "None",
    "time": 5,
    "yield": 67.6
  },
  {
    "reactionId": "r1",
    "temperature": 40,
    "concentration": 0.8,
    "catalyst": "None",
    "time": 10,
    "yield": 74.3
  },
  {
    "reactionId": "r1",
    "temperature": 40,
    "concentration": 0.8,
    "catalyst": "None",
    "time": 20,
    "yield": 80
  },
  {
    "reactionId": "r1",
    "temperature": 40,
    "concentration": 0.8,
    "catalyst": "None",
    "time": 30,
    "yield": 74.4
  },
  {
    "reactionId": "r1",
    "temperature": 40,
    "concentration": 1,
    "catalyst": "None",
    "time": 5,
    "yield": 61.5
  },
  {
    "reactionId": "r1",
    "temperature": 40,
    "concentration": 1,
    "catalyst": "None",
    "time": 10,
    "yield": 66.5
  },
  {
    "reactionId": "r1",
    "temperature": 40,
    "concentration": 1,
    "catalyst": "None",
    "time": 20,
    "yield": 69.8
  },
  {
    "reactionId": "r1",
    "temperature": 40,
    "concentration": 1,
    "catalyst": "None",